{
  "version": 1,
  "destinationId": "central-tasmania",
  "slug": "central-tasmania",
  "seoTitle": {
    "en": "Lake St Clair stargazing: a legal overnight base in Central Tasmania",
    "de": "Stargazing am Lake St Clair: legale Übernachtungsbasis in Zentraltasmanien"
  },
  "seoDescription": {
    "en": "Use a legal Lake St Clair overnight stay for Central Tasmania stargazing and check national-park alerts, wildlife, weather, and road access.",
    "de": "Nutze eine legale Übernachtung am Lake St Clair für Stargazing in Zentraltasmanien und prüfe Nationalparkmeldungen, Wildtiere, Wetter und Straße."
  },
  "standfirst": {
    "en": "Central Tasmania is a broad dark region, not a named observing pad. Lake St Clair provides the defensible decision because accommodation, parking, and park management exist at one exact destination. Book a legal stay or camping arrangement and use only visitor surfaces allowed after dark. Check alerts and passes; never convert the regional coordinate into a roadside stop.",
    "de": "Zentraltasmanien ist eine große dunkle Region, kein benannter Beobachtungsplatz. Lake St Clair liefert die belastbare Entscheidung, weil Unterkunft, Parken und Parkverwaltung an einem exakten Ziel vorhanden sind. Buche eine legale Unterkunft oder Campingregelung und nutze nur nach Dunkelheit erlaubte Besucherflächen. Prüfe Meldungen und Pässe; mache aus der Regionskoordinate keinen Straßenstopp."
  },
  "editorialAngle": {
    "en": "Lake St Clair works best when the observing place is a short walk from a legal bed or campsite. Confirm the stay, parking arrangement, and current park alerts, then keep the session on permitted visitor surfaces. The broad Central Tasmania coordinate is climate context and should never become an improvised roadside stop.",
    "de": "Lake St Clair funktioniert am besten, wenn der Beobachtungsplatz nur einen kurzen Fußweg von einer legalen Unterkunft oder einem Campingplatz entfernt liegt. Bestätige Aufenthalt, Parkregelung und aktuelle Parkmeldungen und bleibe auf erlaubten Besucherflächen. Die breite Zentraltasmanien-Koordinate ist Klimakontext und kein nächtlicher Straßenhalt."
  },
  "sections": [
    {
      "id": "lake-st-clair-is-the-address",
      "heading": {
        "en": "Use Lake St Clair to give the region a lawful address",
        "de": "Lake St Clair gibt der Region eine legale Adresse"
      },
      "paragraphs": {
        "en": [
          "Central Tasmania is a broad dark region, not a named observing pad; setup at Central Tasmania regional reference area waits for that answer. A current notice for Lake St Clair overrides this guide and should change the route immediately.",
          "The booked overnight base is what makes the night workable: it removes a late gate crossing and gives you a lawful place to stop when wildlife, fatigue, or weather changes the plan; Central Tasmania regional reference area is the decision point."
        ],
        "de": [
          "Zentraltasmanien ist eine große dunkle Region, kein benannter Beobachtungsplatz. Lake St Clair liefert die belastbare Entscheidung, weil Unterkunft, Parken und Parkverwaltung an einem exakten Ziel vorhanden sind; der Aufbau am Central Tasmania regional reference area wartet auf diese Antwort. Eine aktuelle Meldung zu Lake St Clair steht über diesem Guide und ändert die Route sofort.",
          "Prüfe Meldungen und Pässe; mache aus der Regionskoordinate keinen Straßenstopp. Erst die gebuchte Übernachtungsbasis macht die Nacht praktikabel: Sie vermeidet eine späte Tordurchfahrt und bietet einen legalen Rückzugsort, wenn Wildtiere, Müdigkeit oder Wetter den Plan ändern; die Alternative ist die direkte Rückfahrt nach Deloraine."
        ]
      },
      "sourceIds": [
        "tas-lake",
        "tas-alerts",
        "tas-know"
      ]
    },
    {
      "id": "walk-from-bed-not-roadside",
      "heading": {
        "en": "Keep the night beside the confirmed stay",
        "de": "Die Nacht neben der bestätigten Unterkunft halten"
      },
      "paragraphs": {
        "en": [
          "Stay on durable surfaces, protect nocturnal wildlife, minimise light near accommodation, and follow every closure. Avoid lakeshore edges and unfamiliar tracks after dark. At Lake St Clair, settle navigation before twilight and keep every lamp, vehicle, and tripod within the boundaries confirmed for this visit.",
          "Reach Lake St Clair before dusk, check in, scout one permitted nearby surface, observe within walking distance of bed, and reassess roads only after daylight. Set the end of the Lake St Clair session while the return still depends on the plan rather than fatigue or a last-minute alternative."
        ],
        "de": [
          "Bleibe auf robusten Flächen, schütze nachtaktive Tiere, minimiere Licht nahe Unterkünften und folge jeder Sperre. Meide Seeuferkanten und unbekannte Wege im Dunkeln. Bei Lake St Clair sollten Navigation und Aufbau vor der Dämmerung abgeschlossen sein; Lampen, Fahrzeug und Stativ bleiben innerhalb der bestätigten Grenzen.",
          "Erreiche Lake St Clair vor Dämmerung, checke ein, erkunde eine erlaubte nahe Fläche, beobachte in Gehweite zum Bett und bewerte Straßen erst bei Tageslicht neu. Lege das Ende bei Lake St Clair so fest, dass der Rückweg vom Plan und nicht von Müdigkeit oder einer spontanen Alternative abhängt."
        ]
      },
      "sourceIds": [
        "tas-lake",
        "tas-alerts",
        "tas-know"
      ]
    },
    {
      "id": "weather-can-lose-without-ruining-the-trip",
      "heading": {
        "en": "Let the daylight landscape carry a cloudy visit",
        "de": "Die Tageslandschaft trägt auch einen bewölkten Besuch"
      },
      "paragraphs": {
        "en": [
          "Mountain cloud, rain, frost, wind, smoke, and fast temperature changes are normal planning factors. Current park alerts can outweigh a promising monthly score. For Lake St Clair, the monthly pattern narrows the season; the departure decision still belongs to the current sky, Moon, access notice, and operator information.",
          "Choose Lake St Clair when the overnight stay and daylight landscape are valuable even if cloud wins. That makes astronomy an excellent layer of the trip rather than its fragile sole purpose. Lake St Clair remains worthwhile only while a legal Lake St Clair stay, parking arrangement, and current park alerts is intact; otherwise choose a walk-from-bed session on permitted visitor surfaces."
        ],
        "de": [
          "Bergwolken, Regen, Frost, Wind, Rauch und schnelle Temperaturwechsel sind normale Planungsfaktoren. Aktuelle Parkmeldungen können einen guten Monatswert überstimmen. Für Lake St Clair grenzt das Monatsmuster die Saison ein; über die Abfahrt entscheiden dennoch aktueller Himmel, Mond, Zugangsmeldung und Betreiberinformation.",
          "Wähle Lake St Clair, wenn Übernachtung und Tageslandschaft auch bei Wolken wertvoll sind. So wird Astronomie eine starke Schicht der Reise statt ihres fragilen einzigen Zwecks. Lake St Clair lohnt sich nur, solange eine legale Übernachtung am Lake St Clair, Parkregelung und aktuelle Parkmeldungen bestehen; andernfalls ist eine Sitzung zu Fuß vom Schlafplatz auf erlaubten Besucherflächen die bessere Wahl."
        ]
      },
      "sourceIds": [
        "tas-lake",
        "tas-alerts",
        "tas-know"
      ]
    }
  ],
  "tour": {
    "title": {
      "en": "A walk-from-bed Lake St Clair sky session",
      "de": "Eine Lake-St-Clair-Himmelssitzung in Gehweite zum Bett"
    },
    "summary": {
      "en": "Reach Lake St Clair before dusk, check in, scout one permitted nearby surface, observe within walking distance of bed, and reassess roads only after daylight; setup at Central Tasmania regional reference area waits for that answer. Current park alerts can outweigh a promising monthly score.",
      "de": "Erreiche Lake St Clair vor Dämmerung, checke ein, erkunde eine erlaubte nahe Fläche, beobachte in Gehweite zum Bett und bewerte Straßen erst bei Tageslicht neu; die Alternative ist die direkte Rückfahrt nach Deloraine. Bergwolken, Regen, Frost, Wind, Rauch und schnelle Temperaturwechsel sind normale Planungsfaktoren. Aktuelle Parkmeldungen können einen guten Monatswert überstimmen."
    },
    "duration": {
      "en": "An evening within a booked overnight stay",
      "de": "Ein Abend innerhalb einer gebuchten Übernachtung"
    },
    "suitability": {
      "en": "Strong for walkers, families, and landscape travellers who want a resilient overnight plan rather than a dedicated astronomy field.",
      "de": "Gut für Wanderer, Familien und Landschaftsreisende, die einen robusten Übernachtungsplan statt eines reinen Astronomiefelds wünschen."
    },
    "sourceIds": [
      "tas-lake",
      "tas-alerts",
      "tas-know"
    ],
    "steps": [
      {
        "id": "central-tasmania-proof",
        "timeHint": {
          "en": "Confirm the arrangement that makes the visit possible",
          "de": "Die Regelung bestätigen, die den Besuch ermöglicht"
        },
        "title": {
          "en": "Lake St Clair: Confirm the arrangement that makes the visit possible",
          "de": "Lake St Clair: Die Regelung bestätigen, die den Besuch ermöglicht"
        },
        "body": {
          "en": "Book the stay, verify park pass and alerts, and check road, smoke, weather, and facility status before crossing into the central highlands. Keep the evidence for a legal Lake St Clair stay, parking arrangement, and current park alerts offline; loss of reception must not broaden the agreed access.",
          "de": "Buche den Aufenthalt, prüfe Parkpass und Meldungen sowie Straße, Rauch, Wetter und Einrichtungen vor der Fahrt ins zentrale Hochland. Speichere den Nachweis für eine legale Übernachtung am Lake St Clair, Parkregelung und aktuelle Parkmeldungen offline; fehlender Empfang darf den vereinbarten Zugang nicht erweitern."
        },
        "sourceIds": [
          "tas-lake",